{
  "schema_version": 1,
  "id": "task-018f8dab",
  "agent_id": "agent-01",
  "type": "shell",
  "arguments": {
    "command": "whoami"
  },
  "timeout_seconds": 30,
  "status": "queued",
  "created_at": "2026-07-23T16:30:00Z",
  "queued_at": "2026-07-23T16:30:00Z",
  "expires_at": "2026-07-23T16:35:00Z"
}
